{
  "$schema": "https://json-schema.org/draft/2020-12/schema",
  "type": "object",
  "additionalProperties": false,
  "required": [
    "created_at",
    "version",
    "candidate",
    "artifact_sha256",
    "gates",
    "blockers"
  ],
  "properties": {
    "created_at": {
      "type": "string"
    },
    "version": {
      "type": "string"
    },
    "candidate": {
      "type": "string"
    },
    "artifact_sha256": {
      "type": "string"
    },
    "gates": {
      "type": "array",
      "items": {
        "type": "object",
        "required": [
          "name",
          "result"
        ],
        "properties": {
          "name": {
            "type": "string"
          },
          "result": {
            "enum": [
              "pass",
              "fail",
              "pending"
            ]
          },
          "evidence": {
            "type": "string"
          }
        }
      }
    },
    "blockers": {
      "type": "array",
      "items": {
        "type": "string"
      }
    }
  }
}
