{
  "created_at": "2026-10-03",
  "version": "2.0.0-rc.4",
  "candidate": "Compiled Governance Architecture",
  "artifact_sha256": "0b50c639cf2d17c52b5d533f3e154e7cbadfc8a4af21e36f18fce9af7640427f",
  "gates": [
    {
      "name": "canonical-source/compiler architecture",
      "result": "pass",
      "evidence": "governance-src is canonical; compiler --check reports exact source/runtime synchronization"
    },
    {
      "name": "governance complexity/static analysis",
      "result": "pass",
      "evidence": "15 policies, 7 hot-path invariants, default closure 3, 0 advisory warnings"
    },
    {
      "name": "runtime cognitive-size budget",
      "result": "pass",
      "evidence": "generated SKILL.md 82 lines; runtime has 3 Markdown files; no references/ or assets/ tree"
    },
    {
      "name": "rule-graph integrity",
      "result": "pass",
      "evidence": "0 duplicate IDs, 0 missing refs, 0 cycles, 0 orphans, 0 conflicting closures"
    },
    {
      "name": "schema-first governance state",
      "result": "pass",
      "evidence": "handoff/execution/feedback/audit schemas plus validate/render/compact/export tests"
    },
    {
      "name": "runtime integrity",
      "result": "pass",
      "evidence": "14 generated runtime files verified by compiler-produced SHA-256 manifest; mutation negative test passes"
    },
    {
      "name": "security static audit",
      "result": "pass",
      "evidence": "no governed network imports, shell=True, dangerous dynamic execution, symlink-following, or secret-like token patterns"
    },
    {
      "name": "Python 3.8",
      "result": "pass",
      "evidence": "12/12 tests; deterministic package SHA-256 matches other runtimes"
    },
    {
      "name": "Python 3.11",
      "result": "pass",
      "evidence": "12/12 tests; deterministic package SHA-256 matches other runtimes"
    },
    {
      "name": "Python 3.13",
      "result": "pass",
      "evidence": "12/12 tests; deterministic package SHA-256 matches other runtimes"
    },
    {
      "name": "upstream Agent Skills validation",
      "result": "pass",
      "evidence": "skills-ref==0.1.1 validation passed on compiled runtime"
    },
    {
      "name": "Skills CLI local discovery/install",
      "result": "pass",
      "evidence": "skills@1.7.0 installed compiled Skill into a clean Codex target; installed-copy integrity passed"
    },
    {
      "name": "private GitHub default-branch install",
      "result": "pass",
      "evidence": "main validation Run #37: skills@1.7.0 cloned private default branch, installed the compiled Skill into a clean Codex target, and installed-copy integrity passed"
    },
    {
      "name": "deterministic release package",
      "result": "pass",
      "evidence": "Python 3.8/3.11/3.13 all produced SHA-256 0b50c639cf2d17c52b5d533f3e154e7cbadfc8a4af21e36f18fce9af7640427f"
    }
  ],
  "blockers": [
    "real-agent trigger false-positive/false-negative qualification",
    "fresh-context behavior comparison against no-Skill/previous baseline",
    "cross-agent A-to-B handoff qualification",
    "token/context/latency overhead qualification before stable"
  ]
}
